{
  "schemaVersion": 1,
  "version": "2026.07.16.spa",
  "updatedAt": "2026-07-16T00:35:22-03:00",
  "records": [
    {
      "id": "trusted-transporte-e-garcia",
      "cnpj": "42040830000192",
      "scope": "EXACT",
      "legalName": "TRANSPORTE E GARCIA LTDA",
      "aliases": [],
      "classification": "TRUSTED",
      "directions": [
        "ORIGIN"
      ],
      "issuers": [
        "GLOBAL"
      ],
      "category": "OTHER",
      "reason": "CNPJ confirmado na lista operacional de origens empresariais confiáveis.",
      "source": {
        "type": "INTERNAL",
        "label": "Lista operacional informada em 16/07/2026",
        "url": ""
      },
      "reviewedAt": "2026-07-16T12:00:00-03:00",
      "active": true,
      "priority": 100
    },
    {
      "id": "trusted-bemol",
      "cnpj": "45445355000122",
      "scope": "EXACT",
      "legalName": "BEMOL",
      "aliases": [],
      "classification": "TRUSTED",
      "directions": [
        "ORIGIN"
      ],
      "issuers": [
        "GLOBAL"
      ],
      "category": "OTHER",
      "reason": "CNPJ confirmado na lista operacional de origens empresariais confiáveis.",
      "source": {
        "type": "INTERNAL",
        "label": "Lista operacional informada em 16/07/2026",
        "url": ""
      },
      "reviewedAt": "2026-07-16T12:00:00-03:00",
      "active": true,
      "priority": 100
    },
    {
      "id": "trusted-tr-rodoali",
      "cnpj": "53802152000174",
      "scope": "EXACT",
      "legalName": "TR RODOALI TRANSPORTES LTDA",
      "aliases": [],
      "classification": "TRUSTED",
      "directions": [
        "ORIGIN"
      ],
      "issuers": [
        "GLOBAL"
      ],
      "category": "OTHER",
      "reason": "CNPJ confirmado na lista operacional de origens empresariais confiáveis.",
      "source": {
        "type": "INTERNAL",
        "label": "Lista operacional informada em 16/07/2026",
        "url": ""
      },
      "reviewedAt": "2026-07-16T12:00:00-03:00",
      "active": true,
      "priority": 100
    },
    {
      "id": "trusted-rede-frota-solutions",
      "cnpj": "24478438000148",
      "scope": "EXACT",
      "legalName": "REDE FROTA SOLUTIONS LTDA",
      "aliases": [
        "REDE FROTA",
        "REDEFROTA",
        "FROTABANK"
      ],
      "classification": "TRUSTED",
      "directions": [
        "ORIGIN"
      ],
      "issuers": [
        "GLOBAL"
      ],
      "category": "OTHER",
      "reason": "CNPJ confirmado na lista operacional de origens empresariais confiáveis.",
      "source": {
        "type": "INTERNAL",
        "label": "Lista operacional informada em 16/07/2026",
        "url": ""
      },
      "reviewedAt": "2026-07-16T12:00:00-03:00",
      "active": true,
      "priority": 100
    },
    {
      "id": "trusted-movix-express",
      "cnpj": "11966182000176",
      "scope": "EXACT",
      "legalName": "MOVIX EXPRESS TRANSPORTE DE CARGAS LTDA",
      "aliases": [],
      "classification": "TRUSTED",
      "directions": [
        "ORIGIN"
      ],
      "issuers": [
        "GLOBAL"
      ],
      "category": "OTHER",
      "reason": "CNPJ confirmado na lista operacional de origens empresariais confiáveis.",
      "source": {
        "type": "INTERNAL",
        "label": "Lista operacional informada em 16/07/2026",
        "url": ""
      },
      "reviewedAt": "2026-07-16T12:00:00-03:00",
      "active": true,
      "priority": 100
    },
    {
      "id": "trusted-dallagnolo-transportes",
      "cnpj": "59259852000140",
      "scope": "EXACT",
      "legalName": "DALLAGNOLO TRANSPORTES LTDA",
      "aliases": [],
      "classification": "TRUSTED",
      "directions": [
        "ORIGIN"
      ],
      "issuers": [
        "GLOBAL"
      ],
      "category": "OTHER",
      "reason": "CNPJ confirmado na lista operacional de origens empresariais confiáveis.",
      "source": {
        "type": "INTERNAL",
        "label": "Lista operacional informada em 16/07/2026",
        "url": ""
      },
      "reviewedAt": "2026-07-16T12:00:00-03:00",
      "active": true,
      "priority": 100
    },
    {
      "id": "trusted-getnet",
      "cnpj": "42054886000104",
      "scope": "EXACT",
      "legalName": "GETNET",
      "aliases": [],
      "classification": "TRUSTED",
      "directions": [
        "ORIGIN"
      ],
      "issuers": [
        "GLOBAL"
      ],
      "category": "OTHER",
      "reason": "CNPJ confirmado na lista operacional de origens empresariais confiáveis.",
      "source": {
        "type": "INTERNAL",
        "label": "Lista operacional informada em 16/07/2026",
        "url": ""
      },
      "reviewedAt": "2026-07-16T12:00:00-03:00",
      "active": true,
      "priority": 100
    },
    {
      "id": "trusted-target",
      "cnpj": "14821124000142",
      "scope": "EXACT",
      "legalName": "TARGET",
      "aliases": [],
      "classification": "TRUSTED",
      "directions": [
        "ORIGIN"
      ],
      "issuers": [
        "GLOBAL"
      ],
      "category": "OTHER",
      "reason": "CNPJ confirmado na lista operacional de origens empresariais confiáveis.",
      "source": {
        "type": "INTERNAL",
        "label": "Lista operacional informada em 16/07/2026",
        "url": ""
      },
      "reviewedAt": "2026-07-16T12:00:00-03:00",
      "active": true,
      "priority": 100
    },
    {
      "id": "trusted-conta-simples",
      "cnpj": "32273196000184",
      "scope": "EXACT",
      "legalName": "CONTA SIMPLES",
      "aliases": [],
      "classification": "TRUSTED",
      "directions": [
        "ORIGIN"
      ],
      "issuers": [
        "GLOBAL"
      ],
      "category": "OTHER",
      "reason": "CNPJ confirmado na lista operacional de origens empresariais confiáveis.",
      "source": {
        "type": "INTERNAL",
        "label": "Lista operacional informada em 16/07/2026",
        "url": ""
      },
      "reviewedAt": "2026-07-16T12:00:00-03:00",
      "active": true,
      "priority": 100
    },
    {
      "id": "attention-mello-intermediacoes",
      "cnpj": "65629658000102",
      "scope": "EXACT",
      "legalName": "MELLO INTERMEDIAÇÕES LTDA",
      "aliases": [],
      "classification": "UNTRUSTED",
      "directions": [
        "BOTH"
      ],
      "issuers": [
        "GLOBAL"
      ],
      "category": "BET_INTERNAL_DENY",
      "reason": "CNPJ marcado pela operação como contraparte de atenção elevada e não localizado nas listas nacionais ou judiciais consultadas.",
      "source": {
        "type": "INTERNAL",
        "label": "Lista operacional e conferência SPA em 16/07/2026",
        "url": "https://www.gov.br/fazenda/pt-br/composicao/orgaos/secretaria-de-premios-e-apostas/lista-de-empresas/confira-a-lista-de-empresas-autorizadas-a-ofertar-apostas-de-quota-fixa-em-2025"
      },
      "reviewedAt": "2026-07-16T12:00:00-03:00",
      "active": true,
      "priority": 200
    },
    {
      "id": "attention-cppay-intermediacoes",
      "cnpj": "62685570000110",
      "scope": "EXACT",
      "legalName": "CPPAY INTERMEDIAÇÕES LTDA",
      "aliases": [],
      "classification": "UNTRUSTED",
      "directions": [
        "BOTH"
      ],
      "issuers": [
        "GLOBAL"
      ],
      "category": "BET_INTERNAL_DENY",
      "reason": "CNPJ marcado pela operação como contraparte de atenção elevada e não localizado nas listas nacionais ou judiciais consultadas.",
      "source": {
        "type": "INTERNAL",
        "label": "Lista operacional e conferência SPA em 16/07/2026",
        "url": "https://www.gov.br/fazenda/pt-br/composicao/orgaos/secretaria-de-premios-e-apostas/lista-de-empresas/confira-a-lista-de-empresas-autorizadas-a-ofertar-apostas-de-quota-fixa-em-2025"
      },
      "reviewedAt": "2026-07-16T12:00:00-03:00",
      "active": true,
      "priority": 200
    },
    {
      "id": "attention-monarch-marketing",
      "cnpj": "67122968000161",
      "scope": "EXACT",
      "legalName": "MONARCH MARKETING LTDA",
      "aliases": [],
      "classification": "UNTRUSTED",
      "directions": [
        "BOTH"
      ],
      "issuers": [
        "GLOBAL"
      ],
      "category": "BET_INTERNAL_DENY",
      "reason": "CNPJ marcado pela operação como contraparte de atenção elevada e não localizado nas listas nacionais ou judiciais consultadas.",
      "source": {
        "type": "INTERNAL",
        "label": "Lista operacional e conferência SPA em 16/07/2026",
        "url": "https://www.gov.br/fazenda/pt-br/composicao/orgaos/secretaria-de-premios-e-apostas/lista-de-empresas/confira-a-lista-de-empresas-autorizadas-a-ofertar-apostas-de-quota-fixa-em-2025"
      },
      "reviewedAt": "2026-07-16T12:00:00-03:00",
      "active": true,
      "priority": 200
    },
    {
      "id": "attention-nelion",
      "cnpj": "63844375000158",
      "scope": "EXACT",
      "legalName": "NELION LTDA",
      "aliases": [],
      "classification": "UNTRUSTED",
      "directions": [
        "BOTH"
      ],
      "issuers": [
        "GLOBAL"
      ],
      "category": "BET_INTERNAL_DENY",
      "reason": "CNPJ marcado pela operação como contraparte de atenção elevada e não localizado nas listas nacionais ou judiciais consultadas.",
      "source": {
        "type": "INTERNAL",
        "label": "Lista operacional e conferência SPA em 16/07/2026",
        "url": "https://www.gov.br/fazenda/pt-br/composicao/orgaos/secretaria-de-premios-e-apostas/lista-de-empresas/confira-a-lista-de-empresas-autorizadas-a-ofertar-apostas-de-quota-fixa-em-2025"
      },
      "reviewedAt": "2026-07-16T12:00:00-03:00",
      "active": true,
      "priority": 200
    },
    {
      "id": "review-gamewiz-brasil",
      "cnpj": "56195099000189",
      "scope": "EXACT",
      "legalName": "GAMEWIZ BRASIL LTDA",
      "aliases": [
        "9F",
        "IJOGO"
      ],
      "classification": "REVIEW",
      "directions": [
        "BOTH"
      ],
      "issuers": [
        "GLOBAL"
      ],
      "category": "BET_AUTHORIZED",